{
  "generated_at": "2026-06-26T20:12:34.174Z",
  "commit": "3d0a9d420cfba240a44d7d4738e63f051d87423c",
  "version": "COR-1.0",
  "requirements": [
    {
      "requirement_id": "CRK1-R001",
      "authority_status": "present",
      "specification_status": "present",
      "implementation_status": "partial",
      "verification_status": "partial",
      "evidence_status": "partial",
      "receipt_status": "complete",
      "provenance_status": "unanchored",
      "reproduction_status": "pending",
      "claim_status": "implemented",
      "exceptions": [
        "no automated repo tests mapped"
      ]
    },
    {
      "requirement_id": "CRK1-R002",
      "authority_status": "present",
      "specification_status": "present",
      "implementation_status": "complete",
      "verification_status": "complete",
      "evidence_status": "complete",
      "receipt_status": "complete",
      "provenance_status": "unanchored",
      "reproduction_status": "pending",
      "claim_status": "implemented",
      "exceptions": []
    },
    {
      "requirement_id": "CRK1-R003",
      "authority_status": "present",
      "specification_status": "present",
      "implementation_status": "partial",
      "verification_status": "partial",
      "evidence_status": "partial",
      "receipt_status": "complete",
      "provenance_status": "unanchored",
      "reproduction_status": "pending",
      "claim_status": "implemented",
      "exceptions": [
        "no automated repo tests mapped"
      ]
    },
    {
      "requirement_id": "CRK1-R004",
      "authority_status": "present",
      "specification_status": "present",
      "implementation_status": "complete",
      "verification_status": "complete",
      "evidence_status": "complete",
      "receipt_status": "missing",
      "provenance_status": "unanchored",
      "reproduction_status": "missing",
      "claim_status": "research",
      "exceptions": [
        "classified as research — outside v1.0 guarantee boundary"
      ]
    },
    {
      "requirement_id": "CRK1-R005",
      "authority_status": "present",
      "specification_status": "present",
      "implementation_status": "partial",
      "verification_status": "partial",
      "evidence_status": "partial",
      "receipt_status": "complete",
      "provenance_status": "unanchored",
      "reproduction_status": "pending",
      "claim_status": "implemented",
      "exceptions": [
        "no automated repo tests mapped"
      ]
    },
    {
      "requirement_id": "CRK1-R006",
      "authority_status": "present",
      "specification_status": "present",
      "implementation_status": "partial",
      "verification_status": "partial",
      "evidence_status": "partial",
      "receipt_status": "complete",
      "provenance_status": "unanchored",
      "reproduction_status": "pending",
      "claim_status": "implemented",
      "exceptions": [
        "no automated repo tests mapped"
      ]
    },
    {
      "requirement_id": "CRK1-R007",
      "authority_status": "present",
      "specification_status": "present",
      "implementation_status": "partial",
      "verification_status": "partial",
      "evidence_status": "partial",
      "receipt_status": "complete",
      "provenance_status": "unanchored",
      "reproduction_status": "pending",
      "claim_status": "implemented",
      "exceptions": [
        "no automated repo tests mapped"
      ]
    },
    {
      "requirement_id": "CRK1-R008",
      "authority_status": "present",
      "specification_status": "present",
      "implementation_status": "partial",
      "verification_status": "partial",
      "evidence_status": "partial",
      "receipt_status": "complete",
      "provenance_status": "unanchored",
      "reproduction_status": "missing",
      "claim_status": "normative",
      "exceptions": [
        "implementation partial but claim remains normative"
      ]
    },
    {
      "requirement_id": "CRK1-R009",
      "authority_status": "present",
      "specification_status": "present",
      "implementation_status": "partial",
      "verification_status": "partial",
      "evidence_status": "partial",
      "receipt_status": "complete",
      "provenance_status": "unanchored",
      "reproduction_status": "missing",
      "claim_status": "normative",
      "exceptions": [
        "implementation partial but claim remains normative"
      ]
    },
    {
      "requirement_id": "CRK1-R010",
      "authority_status": "present",
      "specification_status": "present",
      "implementation_status": "partial",
      "verification_status": "partial",
      "evidence_status": "partial",
      "receipt_status": "complete",
      "provenance_status": "unanchored",
      "reproduction_status": "pending",
      "claim_status": "implemented",
      "exceptions": [
        "no automated repo tests mapped"
      ]
    },
    {
      "requirement_id": "CRK1-R011",
      "authority_status": "present",
      "specification_status": "present",
      "implementation_status": "complete",
      "verification_status": "complete",
      "evidence_status": "complete",
      "receipt_status": "complete",
      "provenance_status": "anchored",
      "reproduction_status": "pending",
      "claim_status": "verified",
      "exceptions": []
    },
    {
      "requirement_id": "CRK1-R012",
      "authority_status": "present",
      "specification_status": "present",
      "implementation_status": "complete",
      "verification_status": "complete",
      "evidence_status": "complete",
      "receipt_status": "complete",
      "provenance_status": "anchored",
      "reproduction_status": "pending",
      "claim_status": "verified",
      "exceptions": []
    },
    {
      "requirement_id": "CRK1-R013",
      "authority_status": "present",
      "specification_status": "present",
      "implementation_status": "partial",
      "verification_status": "partial",
      "evidence_status": "partial",
      "receipt_status": "complete",
      "provenance_status": "unanchored",
      "reproduction_status": "pending",
      "claim_status": "implemented",
      "exceptions": [
        "no automated repo tests mapped"
      ]
    },
    {
      "requirement_id": "CRK1-R014",
      "authority_status": "present",
      "specification_status": "present",
      "implementation_status": "partial",
      "verification_status": "partial",
      "evidence_status": "partial",
      "receipt_status": "complete",
      "provenance_status": "unanchored",
      "reproduction_status": "pending",
      "claim_status": "implemented",
      "exceptions": [
        "no automated repo tests mapped"
      ]
    },
    {
      "requirement_id": "CRK1-R015",
      "authority_status": "present",
      "specification_status": "present",
      "implementation_status": "partial",
      "verification_status": "partial",
      "evidence_status": "partial",
      "receipt_status": "complete",
      "provenance_status": "unanchored",
      "reproduction_status": "pending",
      "claim_status": "implemented",
      "exceptions": [
        "no automated repo tests mapped"
      ]
    },
    {
      "requirement_id": "CRK1-R016",
      "authority_status": "present",
      "specification_status": "present",
      "implementation_status": "partial",
      "verification_status": "partial",
      "evidence_status": "partial",
      "receipt_status": "complete",
      "provenance_status": "unanchored",
      "reproduction_status": "pending",
      "claim_status": "implemented",
      "exceptions": [
        "no automated repo tests mapped"
      ]
    },
    {
      "requirement_id": "CRK1-R017",
      "authority_status": "present",
      "specification_status": "present",
      "implementation_status": "partial",
      "verification_status": "partial",
      "evidence_status": "partial",
      "receipt_status": "complete",
      "provenance_status": "unanchored",
      "reproduction_status": "pending",
      "claim_status": "implemented",
      "exceptions": [
        "no automated repo tests mapped"
      ]
    },
    {
      "requirement_id": "CRK1-R018",
      "authority_status": "present",
      "specification_status": "present",
      "implementation_status": "partial",
      "verification_status": "partial",
      "evidence_status": "partial",
      "receipt_status": "complete",
      "provenance_status": "anchored",
      "reproduction_status": "pending",
      "claim_status": "verified",
      "exceptions": [
        "no automated repo tests mapped"
      ]
    },
    {
      "requirement_id": "CRK1-R019",
      "authority_status": "present",
      "specification_status": "present",
      "implementation_status": "partial",
      "verification_status": "partial",
      "evidence_status": "partial",
      "receipt_status": "complete",
      "provenance_status": "unanchored",
      "reproduction_status": "missing",
      "claim_status": "normative",
      "exceptions": [
        "implementation partial but claim remains normative"
      ]
    },
    {
      "requirement_id": "CRK1-R020",
      "authority_status": "present",
      "specification_status": "present",
      "implementation_status": "partial",
      "verification_status": "partial",
      "evidence_status": "partial",
      "receipt_status": "complete",
      "provenance_status": "unanchored",
      "reproduction_status": "pending",
      "claim_status": "implemented",
      "exceptions": [
        "no automated repo tests mapped"
      ]
    },
    {
      "requirement_id": "CRK1-R021",
      "authority_status": "present",
      "specification_status": "present",
      "implementation_status": "partial",
      "verification_status": "partial",
      "evidence_status": "partial",
      "receipt_status": "missing",
      "provenance_status": "unanchored",
      "reproduction_status": "pending",
      "claim_status": "implemented",
      "exceptions": [
        "no automated repo tests mapped"
      ]
    },
    {